{
  "id": "@ai-workbench/workbench",
  "name": "AI Workbench",
  "npm": "@ai-workbench/workbench",
  "version": "0.1.3",
  "channels": [
    "dsh",
    "hanamesh-client"
  ],
  "categories": [],
  "description": {
    "en": "Installs the networking, connection and remote model plugins required by the writing workbench into official DSH in one step.",
    "zh": "在官方 DSH 一次安装写作工作台所需的联网、连接与远程模型插件。"
  },
  "publisher": {
    "name": "snstotz"
  },
  "sourceUrl": "https://www.npmjs.com/package/@ai-workbench/workbench",
  "status": "listed",
  "review": {
    "reviewedAt": "2026-10-27T19:20:25Z",
    "rulesVersion": "1",
    "label": "unverified",
    "notes": "initial migration"
  }
}
